{
  "traceSchemaVersion": "1.0.0",
  "sessionId": "sesion-2026-08-26T20-54-35.485Z",
  "status": "draft",
  "generatedAt": "2026-08-26T20:54:35.485Z",
  "validationProfile": "quick",
  "agent": {
    "name": "unknown",
    "version": "unknown",
    "provider": "unknown",
    "kind": "unknown",
    "channel": "unknown"
  },
  "request": {
    "summary": "Pendiente de completar por el agente."
  },
  "objective": "Pendiente de completar por el agente.",
  "scope": [],
  "constraints": [],
  "actions": [
    {
      "type": "validation",
      "summary": "Ejecucion de lint",
      "timestamp": "2026-08-26T20:54:35.485Z",
      "status": "omitido"
    },
    {
      "type": "validation",
      "summary": "Ejecucion de typecheck",
      "timestamp": "2026-08-26T20:54:35.485Z",
      "status": "omitido"
    },
    {
      "type": "validation",
      "summary": "Ejecucion de test_frontend_ci",
      "timestamp": "2026-08-26T20:54:35.485Z",
      "status": "omitido"
    },
    {
      "type": "validation",
      "summary": "Ejecucion de test_coverage_ci",
      "timestamp": "2026-08-26T20:54:35.485Z",
      "status": "omitido"
    },
    {
      "type": "validation",
      "summary": "Ejecucion de test_tdd_enforcement_ci",
      "timestamp": "2026-08-26T20:54:35.485Z",
      "status": "omitido"
    },
    {
      "type": "validation",
      "summary": "Ejecucion de test_backend_ci",
      "timestamp": "2026-08-26T20:54:35.485Z",
      "status": "omitido"
    },
    {
      "type": "validation",
      "summary": "Ejecucion de test_portal_ci",
      "timestamp": "2026-08-26T20:54:35.485Z",
      "status": "omitido"
    },
    {
      "type": "validation",
      "summary": "Ejecucion de perf_check",
      "timestamp": "2026-08-26T20:54:35.485Z",
      "status": "omitido"
    },
    {
      "type": "validation",
      "summary": "Ejecucion de pipeline_contract_check",
      "timestamp": "2026-08-26T20:54:35.485Z",
      "status": "ok"
    },
    {
      "type": "validation",
      "summary": "Ejecucion de docs_check",
      "timestamp": "2026-08-26T20:54:35.485Z",
      "status": "falla"
    }
  ],
  "files": {
    "read": [],
    "changed": [
      "apps/backend/reports/qa/latest/global-grade.json",
      "apps/frontend/reports/qa/latest/ux-visual.json",
      "apps/frontend/src/apps/app_docente/GuiaClassroomVisual.tsx",
      "apps/frontend/src/styles/screens.css",
      "docs/INVENTARIO_CODIGO_EXHAUSTIVO.md"
    ],
    "artifacts": [
      "docs/handoff/sesiones/2026-08-26/sesion-2026-08-26T20-54-35.485Z.json",
      "docs/handoff/sesiones/2026-08-26/sesion-2026-08-26T20-54-35.485Z.md"
    ]
  },
  "commands": [
    {
      "name": "lint",
      "command": "npm run lint",
      "status": "omitido",
      "exitCode": null,
      "durationMs": 0,
      "resultSummary": "omitido por perfil quick",
      "timestamp": "2026-08-26T20:54:35.485Z"
    },
    {
      "name": "typecheck",
      "command": "npm run typecheck",
      "status": "omitido",
      "exitCode": null,
      "durationMs": 0,
      "resultSummary": "omitido por perfil quick",
      "timestamp": "2026-08-26T20:54:35.485Z"
    },
    {
      "name": "test_frontend_ci",
      "command": "npm run test:frontend:ci",
      "status": "omitido",
      "exitCode": null,
      "durationMs": 0,
      "resultSummary": "omitido por perfil quick",
      "timestamp": "2026-08-26T20:54:35.485Z"
    },
    {
      "name": "test_coverage_ci",
      "command": "npm run test:coverage:ci",
      "status": "omitido",
      "exitCode": null,
      "durationMs": 0,
      "resultSummary": "omitido por perfil quick",
      "timestamp": "2026-08-26T20:54:35.485Z"
    },
    {
      "name": "test_tdd_enforcement_ci",
      "command": "npm run test:tdd:enforcement:ci",
      "status": "omitido",
      "exitCode": null,
      "durationMs": 0,
      "resultSummary": "omitido por perfil quick",
      "timestamp": "2026-08-26T20:54:35.485Z"
    },
    {
      "name": "test_backend_ci",
      "command": "npm run test:backend:ci",
      "status": "omitido",
      "exitCode": null,
      "durationMs": 0,
      "resultSummary": "omitido por perfil quick",
      "timestamp": "2026-08-26T20:54:35.485Z"
    },
    {
      "name": "test_portal_ci",
      "command": "npm run test:portal:ci",
      "status": "omitido",
      "exitCode": null,
      "durationMs": 0,
      "resultSummary": "omitido por perfil quick",
      "timestamp": "2026-08-26T20:54:35.485Z"
    },
    {
      "name": "perf_check",
      "command": "npm run perf:check",
      "status": "omitido",
      "exitCode": null,
      "durationMs": 0,
      "resultSummary": "omitido por perfil quick",
      "timestamp": "2026-08-26T20:54:35.485Z"
    },
    {
      "name": "pipeline_contract_check",
      "command": "npm run pipeline:contract:check",
      "status": "ok",
      "exitCode": 0,
      "durationMs": 571,
      "resultSummary": "> evaluapro@1.1.1 pipeline:contract:check | > node scripts/pipeline-contract-check.mjs | ✔ ext_perf_arquitectura prepara sharp antes de perf:check (2.2656ms) | ✔ ext_funcionales usa gate OMR TV generico con version configurable (0.7346ms) | ... | ℹ duration_ms 98.9872 | pipeline contract OK",
      "timestamp": "2026-08-26T20:54:35.485Z"
    },
    {
      "name": "docs_check",
      "command": "npm run docs:check",
      "status": "falla",
      "exitCode": 1,
      "durationMs": 1057,
      "resultSummary": "> evaluapro@1.1.1 docs:check | > node scripts/docs.mjs --check | [docs] desactualizado: docs/AUTO_ENV.md | [docs] corre: npm run docs:generate",
      "timestamp": "2026-08-26T20:54:35.485Z"
    }
  ],
  "decisions": [],
  "assumptions": [],
  "risks": [],
  "nextStep": "Pendiente de completar por el agente.",
  "completion": {
    "isComplete": false,
    "pendingFields": [
      "request.summary",
      "objective",
      "scope",
      "decisions",
      "risks",
      "nextStep"
    ]
  },
  "repo": {
    "rootDir": "C:\\Users\\evega\\Documents\\EvaluaPro",
    "branch": "feat/ux-redisenio-integral-1.1.1",
    "commit": "a39774ef",
    "workingTreeStatus": "M apps/backend/reports/qa/latest/global-grade.json\n M apps/frontend/reports/qa/latest/ux-visual.json\n M apps/frontend/src/apps/app_docente/GuiaClassroomVisual.tsx\n M apps/frontend/src/styles/screens.css\n M docs/INVENTARIO_CODIGO_EXHAUSTIVO.md"
  }
}
