{
  "traceSchemaVersion": "1.0.0",
  "sessionId": "sesion-2026-05-22T02-39-12.912Z",
  "status": "draft",
  "generatedAt": "2026-05-22T02:39:12.912Z",
  "validationProfile": "quick",
  "agent": {
    "name": "unknown",
    "version": "unknown",
    "provider": "unknown",
    "kind": "unknown",
    "channel": "unknown"
  },
  "request": {
    "summary": "Pendiente de completar por el agente."
  },
  "objective": "Pendiente de completar por el agente.",
  "scope": [],
  "constraints": [],
  "actions": [
    {
      "type": "validation",
      "summary": "Ejecucion de lint",
      "timestamp": "2026-05-22T02:39:12.912Z",
      "status": "omitido"
    },
    {
      "type": "validation",
      "summary": "Ejecucion de typecheck",
      "timestamp": "2026-05-22T02:39:12.912Z",
      "status": "omitido"
    },
    {
      "type": "validation",
      "summary": "Ejecucion de test_frontend_ci",
      "timestamp": "2026-05-22T02:39:12.912Z",
      "status": "omitido"
    },
    {
      "type": "validation",
      "summary": "Ejecucion de test_coverage_ci",
      "timestamp": "2026-05-22T02:39:12.912Z",
      "status": "omitido"
    },
    {
      "type": "validation",
      "summary": "Ejecucion de test_tdd_enforcement_ci",
      "timestamp": "2026-05-22T02:39:12.912Z",
      "status": "omitido"
    },
    {
      "type": "validation",
      "summary": "Ejecucion de test_backend_ci",
      "timestamp": "2026-05-22T02:39:12.912Z",
      "status": "omitido"
    },
    {
      "type": "validation",
      "summary": "Ejecucion de test_portal_ci",
      "timestamp": "2026-05-22T02:39:12.912Z",
      "status": "omitido"
    },
    {
      "type": "validation",
      "summary": "Ejecucion de perf_check",
      "timestamp": "2026-05-22T02:39:12.912Z",
      "status": "omitido"
    },
    {
      "type": "validation",
      "summary": "Ejecucion de pipeline_contract_check",
      "timestamp": "2026-05-22T02:39:12.912Z",
      "status": "ok"
    },
    {
      "type": "validation",
      "summary": "Ejecucion de docs_check",
      "timestamp": "2026-05-22T02:39:12.912Z",
      "status": "ok"
    }
  ],
  "files": {
    "read": [],
    "changed": [
      "CHANGELOG.md",
      "apps/backend/package.json",
      "apps/backend/reports/qa/latest/e2e-docente-alumno.json",
      "apps/backend/reports/qa/latest/global-grade.json",
      "apps/backend/reports/qa/latest/pdf-print.json",
      "apps/backend/tests/integracion/aislamientoDocente.test.ts",
      "apps/backend/tests/integracion/archivarExamenGenerado.test.ts",
      "apps/backend/tests/integracion/flujoExamen.test.ts",
      "apps/backend/tests/integracion/periodosBorradoDuplicados.test.ts",
      "apps/backend/tests/integracion/qrEscaneoOmr.test.ts",
      "apps/backend/tests/integracion/regenerarExamenGenerado.test.ts",
      "apps/frontend/reports/qa/latest/ux-visual.json",
      "docs/ENGINEERING_BASELINE.md",
      "docs/INVENTARIO_CODIGO_EXHAUSTIVO.md",
      "docs/INVENTARIO_PROYECTO.md",
      "docs/QA_INSTALLER_HUB_DOCENTE_2026-05-20.md",
      ".MCP.precheckout-20260521/",
      "apps/backend/.vitest-reports/",
      "docs/handoff/sesiones/2026-05-21/sesion-2026-05-21T21-12-58.317Z.json",
      "docs/handoff/sesiones/2026-05-21/sesion-2026-05-21T21-12-58.317Z.md",
      "docs/handoff/sesiones/2026-05-21/sesion-2026-05-21T22-25-47.054Z.json",
      "docs/handoff/sesiones/2026-05-21/sesion-2026-05-21T22-25-47.054Z.md",
      "docs/handoff/sesiones/2026-05-22/",
      "scripts/testing/run-backend-coverage-batches.mjs",
      "scripts/tests/backend-coverage-batches.test.mjs"
    ],
    "artifacts": [
      "docs/handoff/sesiones/2026-05-22/sesion-2026-05-22T02-39-12.912Z.json",
      "docs/handoff/sesiones/2026-05-22/sesion-2026-05-22T02-39-12.912Z.md"
    ]
  },
  "commands": [
    {
      "name": "lint",
      "command": "npm run lint",
      "status": "omitido",
      "exitCode": null,
      "durationMs": 0,
      "resultSummary": "omitido por perfil quick",
      "timestamp": "2026-05-22T02:39:12.912Z"
    },
    {
      "name": "typecheck",
      "command": "npm run typecheck",
      "status": "omitido",
      "exitCode": null,
      "durationMs": 0,
      "resultSummary": "omitido por perfil quick",
      "timestamp": "2026-05-22T02:39:12.912Z"
    },
    {
      "name": "test_frontend_ci",
      "command": "npm run test:frontend:ci",
      "status": "omitido",
      "exitCode": null,
      "durationMs": 0,
      "resultSummary": "omitido por perfil quick",
      "timestamp": "2026-05-22T02:39:12.912Z"
    },
    {
      "name": "test_coverage_ci",
      "command": "npm run test:coverage:ci",
      "status": "omitido",
      "exitCode": null,
      "durationMs": 0,
      "resultSummary": "omitido por perfil quick",
      "timestamp": "2026-05-22T02:39:12.912Z"
    },
    {
      "name": "test_tdd_enforcement_ci",
      "command": "npm run test:tdd:enforcement:ci",
      "status": "omitido",
      "exitCode": null,
      "durationMs": 0,
      "resultSummary": "omitido por perfil quick",
      "timestamp": "2026-05-22T02:39:12.912Z"
    },
    {
      "name": "test_backend_ci",
      "command": "npm run test:backend:ci",
      "status": "omitido",
      "exitCode": null,
      "durationMs": 0,
      "resultSummary": "omitido por perfil quick",
      "timestamp": "2026-05-22T02:39:12.912Z"
    },
    {
      "name": "test_portal_ci",
      "command": "npm run test:portal:ci",
      "status": "omitido",
      "exitCode": null,
      "durationMs": 0,
      "resultSummary": "omitido por perfil quick",
      "timestamp": "2026-05-22T02:39:12.912Z"
    },
    {
      "name": "perf_check",
      "command": "npm run perf:check",
      "status": "omitido",
      "exitCode": null,
      "durationMs": 0,
      "resultSummary": "omitido por perfil quick",
      "timestamp": "2026-05-22T02:39:12.912Z"
    },
    {
      "name": "pipeline_contract_check",
      "command": "npm run pipeline:contract:check",
      "status": "ok",
      "exitCode": 0,
      "durationMs": 919,
      "resultSummary": "> evaluapro@1.0.0 pipeline:contract:check | > node scripts/pipeline-contract-check.mjs | ✔ ext_perf_arquitectura prepara sharp antes de perf:check (3.9771ms) | ✔ ext_funcionales usa gate OMR TV generico con version configurable (0.411ms) | ... | ℹ duration_ms 150.5179 | pipeline contract OK",
      "timestamp": "2026-05-22T02:39:12.912Z"
    },
    {
      "name": "docs_check",
      "command": "npm run docs:check",
      "status": "ok",
      "exitCode": 0,
      "durationMs": 1640,
      "resultSummary": "> evaluapro@1.0.0 docs:check | > node scripts/docs.mjs --check | [docs] ok",
      "timestamp": "2026-05-22T02:39:12.912Z"
    }
  ],
  "decisions": [],
  "assumptions": [],
  "risks": [],
  "nextStep": "Pendiente de completar por el agente.",
  "completion": {
    "isComplete": false,
    "pendingFields": [
      "request.summary",
      "objective",
      "scope",
      "decisions",
      "risks",
      "nextStep"
    ]
  },
  "repo": {
    "rootDir": "V:\\Software\\EvaluaPro",
    "branch": "stabilization/v1.0",
    "commit": "1003850",
    "workingTreeStatus": "M CHANGELOG.md\n M apps/backend/package.json\n M apps/backend/reports/qa/latest/e2e-docente-alumno.json\n M apps/backend/reports/qa/latest/global-grade.json\n M apps/backend/reports/qa/latest/pdf-print.json\n M apps/backend/tests/integracion/aislamientoDocente.test.ts\n M apps/backend/tests/integracion/archivarExamenGenerado.test.ts\n M apps/backend/tests/integracion/flujoExamen.test.ts\n M apps/backend/tests/integracion/periodosBorradoDuplicados.test.ts\n M apps/backend/tests/integracion/qrEscaneoOmr.test.ts\n M apps/backend/tests/integracion/regenerarExamenGenerado.test.ts\n M apps/frontend/reports/qa/latest/ux-visual.json\n M docs/ENGINEERING_BASELINE.md\n M docs/INVENTARIO_CODIGO_EXHAUSTIVO.md\n M docs/INVENTARIO_PROYECTO.md\n M docs/QA_INSTALLER_HUB_DOCENTE_2026-05-20.md\n?? .MCP.precheckout-20260521/\n?? apps/backend/.vitest-reports/\n?? docs/handoff/sesiones/2026-05-21/sesion-2026-05-21T21-12-58.317Z.json\n?? docs/handoff/sesiones/2026-05-21/sesion-2026-05-21T21-12-58.317Z.md\n?? docs/handoff/sesiones/2026-05-21/sesion-2026-05-21T22-25-47.054Z.json\n?? docs/handoff/sesiones/2026-05-21/sesion-2026-05-21T22-25-47.054Z.md\n?? docs/handoff/sesiones/2026-05-22/\n?? scripts/testing/run-backend-coverage-batches.mjs\n?? scripts/tests/backend-coverage-batches.test.mjs"
  }
}
