{
  "traceSchemaVersion": "1.0.0",
  "sessionId": "sesion-2026-03-27T06-49-30.218Z",
  "status": "draft",
  "generatedAt": "2026-03-27T06:49:30.218Z",
  "validationProfile": "quick",
  "agent": {
    "name": "unknown",
    "version": "unknown",
    "provider": "unknown",
    "kind": "unknown",
    "channel": "unknown"
  },
  "request": {
    "summary": "Pendiente de completar por el agente."
  },
  "objective": "Pendiente de completar por el agente.",
  "scope": [],
  "constraints": [],
  "actions": [
    {
      "type": "validation",
      "summary": "Ejecucion de lint",
      "timestamp": "2026-03-27T06:49:30.218Z",
      "status": "omitido"
    },
    {
      "type": "validation",
      "summary": "Ejecucion de typecheck",
      "timestamp": "2026-03-27T06:49:30.218Z",
      "status": "omitido"
    },
    {
      "type": "validation",
      "summary": "Ejecucion de test_frontend_ci",
      "timestamp": "2026-03-27T06:49:30.218Z",
      "status": "omitido"
    },
    {
      "type": "validation",
      "summary": "Ejecucion de test_coverage_ci",
      "timestamp": "2026-03-27T06:49:30.218Z",
      "status": "omitido"
    },
    {
      "type": "validation",
      "summary": "Ejecucion de test_tdd_enforcement_ci",
      "timestamp": "2026-03-27T06:49:30.218Z",
      "status": "omitido"
    },
    {
      "type": "validation",
      "summary": "Ejecucion de test_backend_ci",
      "timestamp": "2026-03-27T06:49:30.218Z",
      "status": "omitido"
    },
    {
      "type": "validation",
      "summary": "Ejecucion de test_portal_ci",
      "timestamp": "2026-03-27T06:49:30.218Z",
      "status": "omitido"
    },
    {
      "type": "validation",
      "summary": "Ejecucion de perf_check",
      "timestamp": "2026-03-27T06:49:30.218Z",
      "status": "omitido"
    },
    {
      "type": "validation",
      "summary": "Ejecucion de pipeline_contract_check",
      "timestamp": "2026-03-27T06:49:30.218Z",
      "status": "ok"
    },
    {
      "type": "validation",
      "summary": "Ejecucion de docs_check",
      "timestamp": "2026-03-27T06:49:30.218Z",
      "status": "falla"
    }
  ],
  "files": {
    "read": [],
    "changed": [
      ".github/workflows/ci-installer-windows.yml",
      ".github/workflows/release-beta.yml",
      "CHANGELOG.md",
      "README.md",
      "\"accesos-directos/EvaluaPro - Abrir Dashboard.lnk\"",
      "\"accesos-directos/EvaluaPro - Detener Todo.lnk\"",
      "\"accesos-directos/EvaluaPro - Dev.lnk\"",
      "\"accesos-directos/EvaluaPro - Hub.lnk\"",
      "\"accesos-directos/EvaluaPro - Prod.lnk\"",
      "\"accesos-directos/EvaluaPro - Reiniciar Stack.lnk\"",
      "\"accesos-directos/EvaluaPro - Reparar Entorno.lnk\"",
      "config/update-config.json",
      "docs/DESPLIEGUE.md",
      "docs/ENGINEERING_BASELINE.md",
      "docs/INSTALLER_HUB.md",
      "docs/INVENTARIO_CODIGO_EXHAUSTIVO.md",
      "docs/INVENTARIO_PROYECTO.md",
      "docs/VERSIONADO.md",
      "packaging/wix/Bundle.wxs",
      "packaging/wix/Product.wxs",
      "packaging/wix/README.md",
      "scripts/Install-EvaluaPro.ps1",
      "scripts/build-installer-hub.ps1",
      "scripts/generate-installer-hashes.ps1",
      "scripts/generate-installer-release-manifest.ps1",
      "scripts/installer-hub/InstallerHub.ps1",
      "scripts/installer-hub/modules/OperationalConfig.psm1",
      "scripts/installer-hub/modules/PostInstallVerifier.psm1",
      "scripts/installer-hub/modules/PrereqDetector.psm1",
      "scripts/installer-hub/modules/ProductInstaller.psm1",
      "scripts/launcher-dashboard.mjs",
      "scripts/tests/installer-hub-contract.test.mjs",
      "scripts/tests/release-stable-promotion.test.mjs",
      "scripts/tests/update-api.test.mjs",
      "scripts/tests/update-manager.test.mjs",
      "scripts/tests/windows-release-smoke.test.mjs",
      "scripts/update-manager.mjs",
      "logos/evaluapro-official-hero.png",
      "packaging/wix/theme/"
    ],
    "artifacts": [
      "docs/handoff/sesiones/2026-03-27/sesion-2026-03-27T06-49-30.218Z.json",
      "docs/handoff/sesiones/2026-03-27/sesion-2026-03-27T06-49-30.218Z.md"
    ]
  },
  "commands": [
    {
      "name": "lint",
      "command": "npm run lint",
      "status": "omitido",
      "exitCode": null,
      "durationMs": 0,
      "resultSummary": "omitido por perfil quick",
      "timestamp": "2026-03-27T06:49:30.218Z"
    },
    {
      "name": "typecheck",
      "command": "npm run typecheck",
      "status": "omitido",
      "exitCode": null,
      "durationMs": 0,
      "resultSummary": "omitido por perfil quick",
      "timestamp": "2026-03-27T06:49:30.218Z"
    },
    {
      "name": "test_frontend_ci",
      "command": "npm run test:frontend:ci",
      "status": "omitido",
      "exitCode": null,
      "durationMs": 0,
      "resultSummary": "omitido por perfil quick",
      "timestamp": "2026-03-27T06:49:30.218Z"
    },
    {
      "name": "test_coverage_ci",
      "command": "npm run test:coverage:ci",
      "status": "omitido",
      "exitCode": null,
      "durationMs": 0,
      "resultSummary": "omitido por perfil quick",
      "timestamp": "2026-03-27T06:49:30.218Z"
    },
    {
      "name": "test_tdd_enforcement_ci",
      "command": "npm run test:tdd:enforcement:ci",
      "status": "omitido",
      "exitCode": null,
      "durationMs": 0,
      "resultSummary": "omitido por perfil quick",
      "timestamp": "2026-03-27T06:49:30.218Z"
    },
    {
      "name": "test_backend_ci",
      "command": "npm run test:backend:ci",
      "status": "omitido",
      "exitCode": null,
      "durationMs": 0,
      "resultSummary": "omitido por perfil quick",
      "timestamp": "2026-03-27T06:49:30.218Z"
    },
    {
      "name": "test_portal_ci",
      "command": "npm run test:portal:ci",
      "status": "omitido",
      "exitCode": null,
      "durationMs": 0,
      "resultSummary": "omitido por perfil quick",
      "timestamp": "2026-03-27T06:49:30.218Z"
    },
    {
      "name": "perf_check",
      "command": "npm run perf:check",
      "status": "omitido",
      "exitCode": null,
      "durationMs": 0,
      "resultSummary": "omitido por perfil quick",
      "timestamp": "2026-03-27T06:49:30.218Z"
    },
    {
      "name": "pipeline_contract_check",
      "command": "npm run pipeline:contract:check",
      "status": "ok",
      "exitCode": 0,
      "durationMs": 467,
      "resultSummary": "> evaluapro@1.0.0 pipeline:contract:check | > node scripts/pipeline-contract-check.mjs | ✔ ext_perf_arquitectura prepara sharp antes de perf:check (1.2026ms) | ✔ ext_funcionales usa gate OMR TV generico con version configurable (0.9105ms) | ... | ℹ duration_ms 72.3808 | pipeline contract OK",
      "timestamp": "2026-03-27T06:49:30.218Z"
    },
    {
      "name": "docs_check",
      "command": "npm run docs:check",
      "status": "falla",
      "exitCode": 1,
      "durationMs": 502,
      "resultSummary": "> evaluapro@1.0.0 docs:check | > node scripts/docs.mjs --check | [docs] desactualizado: docs/AUTO_ENV.md | [docs] corre: npm run docs:generate | [docs] desactualizado: docs/AUTO_DOCS_INDEX.md | [docs] corre: npm run docs:generate",
      "timestamp": "2026-03-27T06:49:30.218Z"
    }
  ],
  "decisions": [],
  "assumptions": [],
  "risks": [],
  "nextStep": "Pendiente de completar por el agente.",
  "completion": {
    "isComplete": false,
    "pendingFields": [
      "request.summary",
      "objective",
      "scope",
      "decisions",
      "risks",
      "nextStep"
    ]
  },
  "repo": {
    "rootDir": "C:\\Users\\evega\\EvaluaPro_Sistema_Universitario",
    "branch": "main",
    "commit": "6bdb38d",
    "workingTreeStatus": "M .github/workflows/ci-installer-windows.yml\n M .github/workflows/release-beta.yml\n M CHANGELOG.md\n M README.md\n M \"accesos-directos/EvaluaPro - Abrir Dashboard.lnk\"\n M \"accesos-directos/EvaluaPro - Detener Todo.lnk\"\n M \"accesos-directos/EvaluaPro - Dev.lnk\"\n M \"accesos-directos/EvaluaPro - Hub.lnk\"\n M \"accesos-directos/EvaluaPro - Prod.lnk\"\n M \"accesos-directos/EvaluaPro - Reiniciar Stack.lnk\"\n M \"accesos-directos/EvaluaPro - Reparar Entorno.lnk\"\n M config/update-config.json\n M docs/DESPLIEGUE.md\n M docs/ENGINEERING_BASELINE.md\n M docs/INSTALLER_HUB.md\n M docs/INVENTARIO_CODIGO_EXHAUSTIVO.md\n M docs/INVENTARIO_PROYECTO.md\n M docs/VERSIONADO.md\n M packaging/wix/Bundle.wxs\n M packaging/wix/Product.wxs\n M packaging/wix/README.md\n M scripts/Install-EvaluaPro.ps1\n M scripts/build-installer-hub.ps1\n M scripts/generate-installer-hashes.ps1\n M scripts/generate-installer-release-manifest.ps1\n M scripts/installer-hub/InstallerHub.ps1\n M scripts/installer-hub/modules/OperationalConfig.psm1\n M scripts/installer-hub/modules/PostInstallVerifier.psm1\n M scripts/installer-hub/modules/PrereqDetector.psm1\n M scripts/installer-hub/modules/ProductInstaller.psm1\n M scripts/launcher-dashboard.mjs\n M scripts/tests/installer-hub-contract.test.mjs\n M scripts/tests/release-stable-promotion.test.mjs\n M scripts/tests/update-api.test.mjs\n M scripts/tests/update-manager.test.mjs\n M scripts/tests/windows-release-smoke.test.mjs\n M scripts/update-manager.mjs\n?? logos/evaluapro-official-hero.png\n?? packaging/wix/theme/"
  }
}
