{
  "traceSchemaVersion": "1.0.0",
  "sessionId": "sesion-2026-08-21T22-57-30.400Z",
  "status": "draft",
  "generatedAt": "2026-08-21T22:57:30.400Z",
  "validationProfile": "quick",
  "agent": {
    "name": "unknown",
    "version": "unknown",
    "provider": "unknown",
    "kind": "unknown",
    "channel": "unknown"
  },
  "request": {
    "summary": "Pendiente de completar por el agente."
  },
  "objective": "Pendiente de completar por el agente.",
  "scope": [],
  "constraints": [],
  "actions": [
    {
      "type": "validation",
      "summary": "Ejecucion de lint",
      "timestamp": "2026-08-21T22:57:30.400Z",
      "status": "omitido"
    },
    {
      "type": "validation",
      "summary": "Ejecucion de typecheck",
      "timestamp": "2026-08-21T22:57:30.400Z",
      "status": "omitido"
    },
    {
      "type": "validation",
      "summary": "Ejecucion de test_frontend_ci",
      "timestamp": "2026-08-21T22:57:30.400Z",
      "status": "omitido"
    },
    {
      "type": "validation",
      "summary": "Ejecucion de test_coverage_ci",
      "timestamp": "2026-08-21T22:57:30.400Z",
      "status": "omitido"
    },
    {
      "type": "validation",
      "summary": "Ejecucion de test_tdd_enforcement_ci",
      "timestamp": "2026-08-21T22:57:30.400Z",
      "status": "omitido"
    },
    {
      "type": "validation",
      "summary": "Ejecucion de test_backend_ci",
      "timestamp": "2026-08-21T22:57:30.400Z",
      "status": "omitido"
    },
    {
      "type": "validation",
      "summary": "Ejecucion de test_portal_ci",
      "timestamp": "2026-08-21T22:57:30.400Z",
      "status": "omitido"
    },
    {
      "type": "validation",
      "summary": "Ejecucion de perf_check",
      "timestamp": "2026-08-21T22:57:30.400Z",
      "status": "omitido"
    },
    {
      "type": "validation",
      "summary": "Ejecucion de pipeline_contract_check",
      "timestamp": "2026-08-21T22:57:30.400Z",
      "status": "ok"
    },
    {
      "type": "validation",
      "summary": "Ejecucion de docs_check",
      "timestamp": "2026-08-21T22:57:30.400Z",
      "status": "falla"
    }
  ],
  "files": {
    "read": [],
    "changed": [
      "CHANGELOG.md",
      "apps/backend/package.json",
      "apps/backend/reports/qa/latest/e2e-docente-alumno.json",
      "apps/backend/reports/qa/latest/global-grade.json",
      "apps/backend/reports/qa/latest/pdf-print.json",
      "apps/frontend/reports/qa/latest/ux-visual.json",
      "apps/frontend/src/apps/app_docente/AppDocente.tsx",
      "apps/frontend/src/apps/app_docente/SeccionAsistencias.tsx",
      "apps/frontend/src/apps/app_docente/SeccionCalificaciones.tsx",
      "apps/frontend/src/apps/app_docente/SeccionEscaneo.tsx",
      "apps/frontend/src/apps/app_docente/SeccionRegistroEntrega.tsx",
      "apps/frontend/src/apps/app_docente/SeccionTemarios.tsx",
      "apps/frontend/src/styles/components.css",
      "apps/frontend/tests/escaneo.refactor.test.tsx",
      "apps/frontend/tests/seccionAsistencias.test.tsx",
      "apps/portal_alumno_cloud/package.json",
      "docs/ENGINEERING_BASELINE.md",
      "docs/INVENTARIO_CODIGO_EXHAUSTIVO.md",
      "docs/INVENTARIO_PROYECTO.md",
      "package.json",
      "packaging/wix/BurnBootstrapperApp/MainWindow.xaml.cs",
      "scripts/icons/dashboard-dev.ico",
      "scripts/icons/dashboard-hub-app.ico",
      "scripts/icons/dashboard-hub.ico",
      "scripts/icons/dashboard-open.ico",
      "scripts/icons/dashboard-prod.ico",
      "scripts/icons/dashboard-repair.ico",
      "scripts/icons/dashboard-restart.ico",
      "scripts/icons/dashboard-stop.ico",
      "scripts/icons/installer-canonical.ico",
      "scripts/icons/installer-logo-contrast.ico",
      "apps/frontend/tests/seccionTemarios.test.tsx",
      "cleanup-1787346352993.ps1",
      "cleanup-1787346367719.ps1",
      "scripts/icons/generate-all-icons.mjs"
    ],
    "artifacts": [
      "docs/handoff/sesiones/2026-08-21/sesion-2026-08-21T22-57-30.400Z.json",
      "docs/handoff/sesiones/2026-08-21/sesion-2026-08-21T22-57-30.400Z.md"
    ]
  },
  "commands": [
    {
      "name": "lint",
      "command": "npm run lint",
      "status": "omitido",
      "exitCode": null,
      "durationMs": 0,
      "resultSummary": "omitido por perfil quick",
      "timestamp": "2026-08-21T22:57:30.400Z"
    },
    {
      "name": "typecheck",
      "command": "npm run typecheck",
      "status": "omitido",
      "exitCode": null,
      "durationMs": 0,
      "resultSummary": "omitido por perfil quick",
      "timestamp": "2026-08-21T22:57:30.400Z"
    },
    {
      "name": "test_frontend_ci",
      "command": "npm run test:frontend:ci",
      "status": "omitido",
      "exitCode": null,
      "durationMs": 0,
      "resultSummary": "omitido por perfil quick",
      "timestamp": "2026-08-21T22:57:30.400Z"
    },
    {
      "name": "test_coverage_ci",
      "command": "npm run test:coverage:ci",
      "status": "omitido",
      "exitCode": null,
      "durationMs": 0,
      "resultSummary": "omitido por perfil quick",
      "timestamp": "2026-08-21T22:57:30.400Z"
    },
    {
      "name": "test_tdd_enforcement_ci",
      "command": "npm run test:tdd:enforcement:ci",
      "status": "omitido",
      "exitCode": null,
      "durationMs": 0,
      "resultSummary": "omitido por perfil quick",
      "timestamp": "2026-08-21T22:57:30.400Z"
    },
    {
      "name": "test_backend_ci",
      "command": "npm run test:backend:ci",
      "status": "omitido",
      "exitCode": null,
      "durationMs": 0,
      "resultSummary": "omitido por perfil quick",
      "timestamp": "2026-08-21T22:57:30.400Z"
    },
    {
      "name": "test_portal_ci",
      "command": "npm run test:portal:ci",
      "status": "omitido",
      "exitCode": null,
      "durationMs": 0,
      "resultSummary": "omitido por perfil quick",
      "timestamp": "2026-08-21T22:57:30.400Z"
    },
    {
      "name": "perf_check",
      "command": "npm run perf:check",
      "status": "omitido",
      "exitCode": null,
      "durationMs": 0,
      "resultSummary": "omitido por perfil quick",
      "timestamp": "2026-08-21T22:57:30.400Z"
    },
    {
      "name": "pipeline_contract_check",
      "command": "npm run pipeline:contract:check",
      "status": "ok",
      "exitCode": 0,
      "durationMs": 522,
      "resultSummary": "> evaluapro@1.1.1 pipeline:contract:check | > node scripts/pipeline-contract-check.mjs | ✔ ext_perf_arquitectura prepara sharp antes de perf:check (2.035ms) | ✔ ext_funcionales usa gate OMR TV generico con version configurable (0.773ms) | ... | ℹ duration_ms 90.7746 | pipeline contract OK",
      "timestamp": "2026-08-21T22:57:30.400Z"
    },
    {
      "name": "docs_check",
      "command": "npm run docs:check",
      "status": "falla",
      "exitCode": 1,
      "durationMs": 6349,
      "resultSummary": "> evaluapro@1.1.1 docs:check | > node scripts/docs.mjs --check | [docs] desactualizado: docs/AUTO_ENV.md | [docs] corre: npm run docs:generate",
      "timestamp": "2026-08-21T22:57:30.400Z"
    }
  ],
  "decisions": [],
  "assumptions": [],
  "risks": [],
  "nextStep": "Pendiente de completar por el agente.",
  "completion": {
    "isComplete": false,
    "pendingFields": [
      "request.summary",
      "objective",
      "scope",
      "decisions",
      "risks",
      "nextStep"
    ]
  },
  "repo": {
    "rootDir": "C:\\Users\\evega\\Documents\\EvaluaPro",
    "branch": "main",
    "commit": "fdea4750",
    "workingTreeStatus": "M CHANGELOG.md\n M apps/backend/package.json\n M apps/backend/reports/qa/latest/e2e-docente-alumno.json\n M apps/backend/reports/qa/latest/global-grade.json\n M apps/backend/reports/qa/latest/pdf-print.json\n M apps/frontend/reports/qa/latest/ux-visual.json\n M apps/frontend/src/apps/app_docente/AppDocente.tsx\n M apps/frontend/src/apps/app_docente/SeccionAsistencias.tsx\n M apps/frontend/src/apps/app_docente/SeccionCalificaciones.tsx\n M apps/frontend/src/apps/app_docente/SeccionEscaneo.tsx\n M apps/frontend/src/apps/app_docente/SeccionRegistroEntrega.tsx\n M apps/frontend/src/apps/app_docente/SeccionTemarios.tsx\n M apps/frontend/src/styles/components.css\n M apps/frontend/tests/escaneo.refactor.test.tsx\n M apps/frontend/tests/seccionAsistencias.test.tsx\n M apps/portal_alumno_cloud/package.json\n M docs/ENGINEERING_BASELINE.md\n M docs/INVENTARIO_CODIGO_EXHAUSTIVO.md\n M docs/INVENTARIO_PROYECTO.md\n M package.json\n M packaging/wix/BurnBootstrapperApp/MainWindow.xaml.cs\n M scripts/icons/dashboard-dev.ico\n M scripts/icons/dashboard-hub-app.ico\n M scripts/icons/dashboard-hub.ico\n M scripts/icons/dashboard-open.ico\n M scripts/icons/dashboard-prod.ico\n M scripts/icons/dashboard-repair.ico\n M scripts/icons/dashboard-restart.ico\n M scripts/icons/dashboard-stop.ico\n M scripts/icons/installer-canonical.ico\n M scripts/icons/installer-logo-contrast.ico\n?? apps/frontend/tests/seccionTemarios.test.tsx\n?? cleanup-1787346352993.ps1\n?? cleanup-1787346367719.ps1\n?? scripts/icons/generate-all-icons.mjs"
  }
}
